"9","Leiktæki fyrir eldri börn og unglinga  á leikvöll við Ljósheima Að komið verði upp einu góðu fjölhæfu leiktæki fyrir eldri börn og unglinga á Ljósheimavellinum. Draumur að fá skemmtilegt klifurtæki  klifurvegg eða annað, eins og Krumma-flow frá Krumma."
"4","Endurskoða hundagerði hjá BSÍ Helluleggja hundagerðið að hluta til - það þarf að vera gras þar líka - það virðist vera eina leiðin til að það verði notað eitthvað að ráði - það er undantekning ef einhver hundur er þar á ferð"
"15","Ljós i myrkri! Bæta lýsingu í Grasagarðinum og á göngustígum í Laugardalnum og við Langholtsskóla. "
"14","Útikennslustofu í Grundargerðisgarð!"
"22","Endurhana útivistarsvæði/Leiksvæði fyrir börn  Neðst í suðurhlíðum er svæði sem markast af Reynihlíð og Víðihlíð  þarna var leikvöllur fyrir börn með leiktækjum og sandkassa , nú hefur verið fjarlægt mest af þessu og er þetta svæði frekar ljótt að mínu mati. Hér væri tækifæri til að endurhana svæðið og gera fallegt útivistarsvæði fyrir íbúa svæðisins. Þarna eru risa stórar aspir sem mynda stóran skugga á svæðinu, þær verður að fella og setja lággróður í staðinn     "
"14","Grindverk meðfram Kringlumýrarbraut austantil  meðfram Laugarneshverfi. Þarft væri að fá grindverk meðfram Kringlumýrarbraut á þeim parti sem snýr að Laugarneshverfi  frá Sigtúni og niður fyrir Laugateig.   Hætta skapast fyrir börn þar sem bæði Laugateigur og Sigtún liggja beint niður að þessari stóru umferðargötu og mikið er um börn að leik."
"14","Fegrum göngin undir Snorrabraut Göngin undir Snorrabraut eru bráðnauðsynleg gangandi vegfarendum og hjólafólki sem þarf að komast milli Hlíðanna og miðbæjar. Svæðið er núna ljótt vegna skemmdarverka metnaðarlausra aumingja með tússpenna og spreibrúsa  sem ekki hafa neinn listrænan metnað annan en að skrifa nafnið sitt á sem óskiljanlegastan máta. Hugmyndin er að fá einhvern með listrænan metnað til að gera heildstætt vegglistaverk yfir allan vegginn. Bjóðum verkefnið út, fáum tilboð frá alvöru vegglistamanni með metnað."
"11","Skólabrú : Umferð  Holræsakerfi, Sorphreinsun."
"22","Vistgötur í Norðurmýri. 15 km hámarkshraði. Að breyta öllum götum í Norðurmýri í vistgötur og lækka hámarkshraða niður í 15 km. á klst. "
"15","Hjólreiða Samgöngu Kerfi Að hannað verði samgöngu kerfi fyrir reiðhjól  að norænni fyrirmynd eins fljótt og kostur sé á. "
"9","Hafa rýmri opnunartíma í Árbæjarlaug"
"11","Sælureitir (kolonihaver) innan borgarinnar sem íbúar geta tekið á leigu Borgin standi fyrir gerð sælureita  sem íbúar borgarinnar geta fengið til langtímaleigu sbr. kolonihaver sem eru algengir í mörgum Evrópulöndum   Reitirnir eru einkum nýttir til grænmetis – og ávaxtaræktar. "
"13","Alvöru húsaleigukerfi í Reykjavík"
"14","Breyta Lönguhlíð í  Esplanade""
"16","Bekkir við göngustíga í Vogahverfi  Bekki við göngustíga vantar fyrir þá sem stunda útivist og gönguferðir í Vogahverfi og í nágrenni Langholtskirkju. Svæðið er vinsælt til útivistar og  gönguferða fyrir fólk á öllum aldri.  Góðir göngustígar eru í hverfinu  en nauðsynlegt er hafa bekki við göngustígana þannig að stígarnir komi sem flestum að notum.  Þannig geta eldri borgarar notið útivistar í hverfinu sínu til jafns við aðra. "
"13","Geðheilbrigði fyrir alla. Félagsmiðstöð fyrir allan aldur"
"25","Tún bakvið Vesturbæjarlaug verði hundagerði Túnið bak við Vesturbæjarlaug er stórt og gott. Þar er gott samfélag hunda og manna sem hittast oft þar. Fá hvuttar að hlaupa lausir um en það er bannað  samkvæmt reglugerðum borgarinnar. Þarna mætti með auðveldum hætti girða af góðan skika og búa til alvöru hundagerði eins og í Mosfellsbæ."
"3","Geirsgata í stokk Það þarf að huga að Geirsgötunni hið snarasti  setja í stokk bæði vegna mikilli umferð, þrengsli og aukin búsetu á Mýrargötunni og Grandaveg. "
"21","Umferðaröngþveiti við Garðsapótek Það þarf að skipuleggja betur umferð bílandi  gangandi og hjólandi vegfarenda við Garðsapótek. Þar er oft algjört kaos og sérstaklega er gangandi og hjólandi fólk í mikilli hættu. Gangstéttin fyrir framan apótekið er mjög mjó og varla hægt að mætast á henni. Bílar leggja og bakka þarna þvers og kruss og árekstrar tíðir. Skipulegga þetta þannig að öryggi vegfarenda sé sett ofar öllu öðru."
"11","Grænt svæði í Suðurhlíðum Neðst við byggðina í Suðurhlíðum  við Suðurhlíð, er autt svæði sem er malbikað. Ég legg til að malbikið verði fjarlægt og þar verði gróðursett. Nýta má svæðið sem hvíldarstað fyrir göngufólk sem þarna fer um. "
"11","Umbúðir til endurvinnslu merktar með lit"
"14","Boltagerði/sparkvöll við Kelduskóla - Vík og Vættaskóla - Engi Verkefnið snýst um að setja upp boltagerði við Vættaskóla - Engi og Kelduskóla - Vík."
"22","Opna göngustíginn yfir Sorrabraut Það liggur göngustígur á milli lóða frá Gunnarsbraut í gegnum Auðarstræti að Snorrabraut.  Hinu meginn við Snorrabrautina heldur göngustígurinn áfram að Leifsgötu og upp Leifsgötu að Hallgrímskirkju  þar er göngubraut yfir Barónstíg.  Gallinn er þó að það er girðing á milli akgreina á Snorrabraut og ekki gert ráð fyrir að ganga yfir götuna þar sem þessi göngustígur liggur.  Hugmyndin er einfaldlega að opna girðinguna þarna á milli og setja gangbraut yfir yfir Snorrabraut þarna."
"15","Láta græna ljósið blikka 2-3 sinnum áður en það kemur á gult"
"14","Gera gangstéttir í hverfinu hjólavænni.  Mikið vantar upp á að t.d. gangstéttarkantar séu aflíðandi við gangbrautir eða á augljósum stöðum (til dæmis við innkeyrslu á elliheimilið Dalbraut 18  þar er minnir mig aflíðandi kantur öðru megin en ekki hinum megin!). Þetta ætti að vera ódýr framkvæmd en öllu hjólafólki til mikillar gleði, sem og barnafólki sem fer með kerrur og barnavagna. "
"9","Drykkjarhanar í Grafarholti ca 3-4 staðir Setja upp drykkjarhana á ca 3-40 stöðum í hverfinu fyrir fólk á ferðinni  fólk á göngu eða skokki eða börn á leið á eða af æfingum."
"8","Strandblakvellir í Árbæinn Blakdeild Fylkis hefur barist fyrir að fá strandblakvelli við Fylkissvæðið undanfarin ár en illa gengið. Mikill uppgangur hefur verið í strandblaki undanfarin ár. Hægt er að koma 2 völlum fyrir án mikillar fyrirhafnar við Árbæjarlaug. Væri þetta mjög góð viðbót við útivistarparadísina við Elliðarárd"
"11","Gróðursetja aspir við Maríubaug Gróðursetja aspir við Maríubaug á móts við hús nr. 143 til að skapa aukið skjól. Mikill vindstrengur kemur þarna  sérstaklega í austanátt, og snjó skefur í innkeyrsluna. Reyndar mætti planta almennt fleiri trjám í Grafarholti til að skapa meira skjól."
"16","Setja bekk neðst í gnoðarvoginn Hugmyndin er sú að settur yrði bekkur í botlangan í neðst í gnoðarvogi einhversstaðar milli langholtsvegar og eikjuvogs. Einföld og ódýr hugmynd. "
"14","Gróðursetja fleiri tré niður Höfða að Gullinbrú "
"14","Nýta garðinn við Vesturbæjarsundlaug"
"8","Sérstaða hugsanlegrar sundlaugar Ef til álita kemur að setja niður sundlaug hér á þessu svæði er óþarfi að sú laug verði efirlíking af nærliggjandi sundlaugum. Dýfingapallur gæti verið ódýrari í rekstri en vatnsrennibraut og opnað leiðir fyrir ný ævintýri. "
"13","Kenna börnum að umgangast hunda"
"3","Bílastæði við Bólstaðarhlíð! Bílastæðin við Bólstaðarhlíð 44-40 eru alveg óboðanleg að mínu mati  í fyrsta lagi eru þau mjög fá og þröng. Í öðru lagi er mikil hætta á árekstri. En hinum megin við blokkina er risa stórt tún sem enginn virðist nota, það væri fullkomið fyrir bílastæði. Væri ekki hægt að gera bílastæði þar?"
"4","Skýrt ljósmerki um alla borg klukkan 00:00 á gamlárskvöld"
"20","Einar Benediktsson í Spöngina Styttan af Einari Benediktssyni verði komið fyrir á torgarmiðju í Spönginni í Grafarvogi. Þessi stytta er ekki á nógu áberandi svæði núna og minningu Einars ekki nógu mikill sómi sýndur. Vel fer á því að styttan af Einari blasi við þeim sem eiga erindi í bókasafnið í Grafarvogi og verslanir þar enda er þar miðja fyrir 17 þúsund manns sem búa í Grafarvogi. Í tengslum við þetta verði búið til torgarmiðja í Spönginni þar sem styttan verður miðpunkturinn.   "
"10","Brjótum upp kennslustundir með aukinni hreyfingu og leik"
"14","Fleiri bekkir í hverfið hér er margt um eldra fólk ."
"14"," Carousel" Hringekju í Hljómskálagarðinn"
"10","Bjóða væntanlegum 1. bekkingum í sumarfrístund"
"3","Samspil bílumferðar og gangandi/hjólandi umferðar. Hugmyndin gengur út á að gera undirgöng undir Hringbraut við Þjóðminjasafnið og taka burt gangbrautarljós  bæta aðgengi strætisvagna við biðskýlin, og breyta gatnamótum Hringbrautar og Sæmundargötu. í þeim tilgangi að auka umferðaröryggi og útrýma þeim flöskuhálsi sem myndast við hringtorg Hringbrautar og Suðurgötu. með þessu yrði flæði bílaumferðar sem og annarar umferðar mun jafnara."
"9","Göngu og hjólastíg í kringum í Geldinganes Geldinganes er falin á náttúruperla sem minnir örlítið á Hornstrandir með fallegar strendur sem fæstir hafa séð.   Með því að gera góðan malar eða malbikaðanstíg væri hægt að njóta þessar perlu mun betur.  Það þyrfti einnig að setja upp einhverskonar lýsingu þar til að geta notið þess að ganga þarna á veturna.  "
"11","hljóðvarnarvegg við Selásbraut"
"14","Kolaportið á nýjan stað !!! :-)"
"14","Gangstétt á Sléttuveg frá strætóskýli að Sléttuvegi 7 Lögð verði gangstétt frá strætóskýli við Sléttuveg að Sléttuvegi 7 og tengd við gangstéttina fyrri framan Sléttuveg 9a. Hér er mikil umferð gangandi vegfarenda en engin gangstétt á þessum hluta Sléttuvegs. Íbúar á Sléttuvegi 7 og 9 eru flestir fatlaðir svo þetta er sérlega mikilvægt. Mikil umferð er um götuna og þar þurfa þeir sem leið eiga um að ganga sem skapar mikla hættu ekki síst á vetrum þegar færð er slæm"
"10","Jafnrétti innan skólakerfisins"
"15","Bætt lýsing á Klambratúni Að göngustígar á Klambratúni verði lýstir upp svo gangandi vegfarendur geti öryggir gengið um svæðið allan sólarhringinn allan ársins hring."
"3","Bæta útisvæði við Eiðsvík og Geldinganes"
"14","Laga garðinn bakvið Miðbæ Bakvið Miðbæ við Háaleitisbraut er skemmtilegur garður og mjög veðursæll á sumrin. Við fjölskyldan höfum stundum farið með nesti og teppi þangað. Hann er hinsvegar í órækt og mjög sjaldan sleginn yfir sumartímann. Það væri hægt að gera mikið fyrir þetta svæði með því að koma fyrir borðum með bekk og kannski 1/2 leiktækjum. Svipuð framkvæmd var gerð við svæðið fyrir aftan Grennsárskirkju í fyrra og er allt annað að sjá það. Þetta þarf ekki að vera kosnaðarsöm aðgerð en vekur eflaust mikla lukku."
"24","Suðurgata Umferðarhraði og þungi of mikill miðað við götugerð. Halló Reykjavik !   Umferðarþunginn á Suðurgötu er allt of mikill.  Hluti af honum má útskýra með strætó umferð.  Engin stoppustöð er í götunni.  Það eru til betri leiðir en gegnum þessa fallegu og friðsælu götu til að komast inn á Hringbraut/miklubraut frá miðbæ.    -Til dæmis meðfram sjó í átt að Granda eða meðfram tjörninni.  [Framhald í næsta glugga]"
"14","Gangstétt Stigahlíð (á milli Hamrhlíð og Grænuhlíð) Endurnýja gangstétt í Stigahlíð (á milli Hamrhlíðar Grænuhlíðar)"
"25","gangstígar og götur í vesturbæ Gangstígur við Eiðisgranda á móti Boðagr. og Álagranda   ekki sjávarmegin, er illfær sakir slits og polla og hálku sem myndast í frosti.  Einnig er slæmt sig, sem fyllist af vatni á Fjörugranda og Einimel, hættulegt börnum sakir dýptar !!  "
"14","Gróðursetja tré meðfram Bústaðavegi. Hvenær verður farið í samþykkta framkvæmd? Hvað varð um hugmyndina og framkvæmdina sem samþykkt var í kosningu fyrir tæpu ári síðan um að gróðursetja tré meðfram Bústaðavegi en ekki enn verið framkvæmd ? Hvenær verður farið í samþykktar framkvæmdir ? "
"25","Vatnshanar Fjölga þarf vatnshönum við aðal stíga.  Enginn vatnshani er í vesturbænum í dag ( sem virkar)"
"17","Laga efsta hluta Rafstöðvarvegar Malbika efsta hluta Rafstöðvarvegar (frá undirgöngum undir Höfðabakka að  allur akstur bannaður" skiltinu. Malbikið/slitlagið orðið mjög lélegt þarna sem gerir það leiðinlegt yfirferðar fyrir hangandi  hlaupandi og hjólandi vegfarendur."
"11","Upplýsingar um flokkun til innflytjenda Þetta er frekar spurning en hugmynd. Ég bý í nágrenni við innflytjendur (nokkrir í hverfinu) og margir þeirra skilja illa slensku og hugtakið flokkun er þeim framandi. Veit einhver hvernig fræðslu til þeirra verður háttað? "
"11","Burt með hljóð- og loftmengun endilanga Háaleitisbrautina :) Bregðumst við mikilli hljóðmengun og loftmengun með vistvænlegum hætti. Gróðursetjum alla Háaleitisbrautina á milli akreina til að draga úr hljóð- og loftmengun  og til að fegra ásýnd götunnar. Þá er hægt að njóta fallegra trjáa og jafnvel gróðurs í kringum trén á sumrin og svo er hægt að skreyta trén fallegum jólaljósum yfir hátíðarnar. Borðliggjandi."
"14","Færanlegur kaffistandur í Grafarholtið yfir sumarið Fyrir fólk til að nýta sér á leið í vinnu eða til að hittast á yfir daginn þegar það er t.d. í sumarfríi. Kaffivagninn við skóla/leikskóla hvetur fólk að ganga með börnin í leikskólann  ná sér í kaffi og hugsanlega taka svo strætó í vinnuna. Fyrir fólk í fríi væri gaman að koma við og ná sér í bolla fyrir/eftir göngutúr og/eða til að mæla sér mót við aðra. Þegar gott veður er úti væri gaman að hafa nokkra stóla og borð fyrir fólk til að setjast. Standurinn gæti færst um hverfið."
"16","Leikvöllur í Laugardalinn Laugardalurinn væri kjörin staðsetning fyrir stóran og flottan leikvöll með skemmtilegum og frumlegum leiktækjum og bekkjum og borðum í skjóli trjánna  þar sem öll fjölskyldan getur komið saman, farið í piknikk, leikið sér og átt góðar stundir."
"15","Laga göngustíg milli Laugardalslaugar og tjaldstæðis Nauðsynlegt er að malbika göngustíg sem liggur frá Sundlaugarvegi að kastsvæðinu í Laugardal. Stígurinn liggur austan við Laugardalslaug og vestan tjaldsvæðis. Syðsti hluti þessa stígs var lagaður í fyrra en nú þarf að klára norðurhluta hans. Einnig er þörf á að loka honum fyrir bílum."
"15","Lagfæra göngustíg með  Fossvogsvegi."
"13","Athvarf geðsjúkra  Vin verði opið ÁFRAM"
"11","Lýsa upp göngustígana á Geirsnefinu."
"15","Breyta neðsta hluta gangstéttar við Lokastíg í bílastæði. Neðst á Lokastíg við Týsgötu er gangstéttinn tvöföld. Lagt til að breyta þessum hluta í bílastæði fyrir einn bíl eins og neðst á efrihluta Lokastígs  við Baldursgötu."
"16","Borgartún: Laga aðgengi að húsum frá gangstétt og hjólastíg Það hefði verið gott að huga betur að tengingu frá gangstétt og hjólreiðabraut inn að húsum við Borgartún. Hef ég sérstaklega tekið eftir þessu við númer 24 ( Lífandi markaður eða álíka )"
"15","Hreinsa betur snjó og vanda söndun. Sópa upp sand þegar er þurrkur. Þeir sem taka að sér að ryðja gang- og hjólastíga þegar snjóar þurfa að vanda sig betur. Títt er að ruðningar séu skildir eftir við enda stíga og að sandi sé ekki dreift jafnt heldur í hrúgum.   þegar hlánað hefur og gerir þurrt veður er sandurinn lausi á stígunum orðinn slysagildra.  Þess vegna á að sópa hann við fyrsta tækifæri þegar er þurrkur."
"19","Bæta leiksvæðið við Ingunnarskóla Tillagan er sú að bæta leiksvæðið við Ingunnarskóla til muna.  Gera þarf róttækar breytingar á svæðinu í heild  setja upp fleiri tæki, tryggja meiri fjölbreytni í umhverfinu, gróðursetja almennilega skjólgarða og gera svæðið mun vistlegra og skemmtilegra fyrir börnin okkar."
"15","Hestaleiga og hestvagnaleiga í Hallargarði við Fríkirkjuveg"
"16","Leiksvæði við frístundaheimilið Glaðheima Á frístundaheimilinu Glaðheimum eru um það bil 140 börn á aldrinum 6-7 ára. Þeim þykir mjög gaman að leika sér úti en því miður erum við ekki með neitt leiksvæði til þess að bjóða þeim uppá að leika sér á. Við hliðina á Glaðheimum er stór auð lóð sem væri tilvalið að setja nokkur leiktæki á. Það myndi gleðja krakkana einstaklega mikið að fá tækifæri á að róla  vegasalt, spila fótbolta ofl sem gerði útiveruna skemmtilegri."
"11","Boule ( Boccia ) vellir á Klambaratúni og í Laugardal Boule ( Boccia ) er leikur sem er spilaður á völlum með leirlagi og eru   15m X 4m með plönkum í kring til að afmarka völlin  í leiknum eru notaðar stálkúlur þessi leikur er mikið stundaður erlendis og þetta er í næsta nágreni við íbúðir eldri borgara og gæti stuðlað að meiri útiveru á góðvirðisdög"
"9","Setja tröppur í leikkastalann í Hljómskálagarðinum Kastalinn í Hljómskálagarðurinn er ágætur  með skemmtilegri tvíbreiðri rennibraut sem hentar vel fyrir yngstu börnin. Hins vegar er stór galli að yngstu börnin komast ekki upp í kastalann þar sem þar eru engar tröppur upp. Eina leiðin til að komast upp er að klifra upp klifurvegg eða upp net sem bara eldri börn ráða við. Ef það væri hægt að breyta honum þannig að setja tröppur þá mundi hann nýtast mun fleiri börnum."
"3","Fylgjast með Gistirýmum í hverfinu Hversu mörgum íbúðum er búið að breyta í gistirými fyrir ferðafólk? Hversu mikið má breytast í gistirými fyrir ferðafólk og hvaða áhrif hefur það á hverfið? Ferðafólk hefur að mörgu leyti góð áhrif á verslun og þjónustu í hverfinu en það fylgir þeim líka margt annað og það getur verið skrýtið þegar heilu og hálfu göturnar breytast í gistirými. Þá  eiga íbúar alltíeinu enga nágranna. Það þarf að fylgjast með þessu  móta stefnu og ræða með íbúum og ferðaþjónustuaðilum."
"15","Ókeypis í strætó og tíðari ferðir"
"15","30 km/h í Álfheimum  Lækka hámarkshraða í Álfheimum úr 50 km/h í 30 km/h."
"9","stress losandi rými Rými þar sem að fólk gæti komið saman og gert óformlega hluti saman- og haft kózý &/eða Gaman :) skemmt sér og lyft upp á allskonar skapandi vegu. M.a. með því að mála  dansa, nudda hvort annað, gera jóga, hugleiða, gera hollan mat og svo frammvegis...+ "
"12","Hjólastígar í Elliðárdalur Hugmyndin felst í því að vera með tvöfalda stíga í Elliðárdalnum;  annarsvegar göngustíga og hinsvegar hjólreiðastíga (sem skipt er í tvær akgreinar með merkingum  sbr. því sem er í Fossvogsdal)"
"11","laga leikvöll á milli Melhaga og Neshaga  Nýjum tækjum komið fyrir á leikvöll á milli Melhaga og Neshaga "
"4","bjóða fólki vökvun á rykmiklum steypumulningsförmum í sorpu til lungnaverndar fólk vill drífa verkið af og hugsar of lítið um að passa lungun  í logni gýs upp mikið steinrykský af kerrum sem mokað er af og steinklumpar teknir af , en á annatíma hefur starfsfólk lítinn tíma fyrir leiðbeiningar, það gæti verið skilti við steinefnagám sem býður að sækja vatnsfötur í skúrinn starfsmanna, eða betra garðkönnur , eða betra vökvunarkerfi hangandi yfir svæðinu eða líka við hliðið þar sem starsm taka á móti þeir gætu vökvað. í hátölurum við gáminn gætu verið leiðbeiningar um vökvun"
"3","Lokun gatnamóta  Ásendi og Garðsendi Tunguvegur  Garðsndi og Ásendi mynda hring í 30 hverfi, það myndast mikill hraði þegar fólk flýtir sér hvora leiðina sem er. Lokun gatnamótanna Ásendi\Garðsendi myndi gera hverfið rólegra og bæta öryggið í hverfinu."
"8","Endurbætur á tennisvöllum í Fossvogsdal"
"14","Hiti í gangstétt upp af Sundlaug Árbæjar Setja hitalagnir í gangstíg sem liggur upp af Sundlaug Árbæjar. Freistandi er að leggja hitalagnir í allan stíginn alveg frá sundlauginni og upp að Selásbraut."
"11","Trjágróður á milli göngu/hjólastíga og umferðargatna "
"15","Ferð í strætó innifalin í miðanum. Við þekkjum öll umræðuna um sektargleði lögreglunar þegar eitthvað er að gerast í Laugardalnum eða í miðbænum  væri ekki upplagt að miðinn á leikinn eða tónleikana myndi líka gilda sem miði fram og til baka með strætó?"
"14","Stað í byggingu Bónus fyrir Littla og Stóra Skerjafjörð Stað í byggingu Bónus fyrir Littla og Stóra Skerjafjörð  Stúdentaíbúðir í Vatnsmyrarhverfi. það getur verið BónusExpress eins það er TescoExpress á utlöndum."
"14","Bæta  aðgengi til og frá Heiðmörk við Suðurlandsveg"
"15","Malbika vegbút milli Sævarhöfða og Stórhöfða"
"15","Vegvísanir fyrir hjólandi umferð/stíga merkingar Gott net hjólaleiða er í borgarlandinu. Það vantar sárlega að setja upp merkingar  vegvísanir, sem segja hvert leiðin liggur og hversu langt er þangað. Eins þarf að huga að merkingum gatna út frá gangandi vegfarendum. Þegar komið er  hinu megin" að botngötu, er fátt sem segir á hvaða götu þú ert staddur."
"14","Undirgöng undir Víkurveg milli Staða- og Víkurhverfis"
"10","Efla Umhverfis- og náttúrunám"
"15","Akrein fyrir Strætó vestur frá Ártúni "
"14","Skautaaðstaða við Rauðavatn. Hreinsa krikan á Rauðavatni af stærsta grjótinu og setja fínni möl við vatnið fyrir skautaaðstöðu. Á þeim dögum sem vatnið er frosið mætti hugsa sér tónlistarflutning við vatnið td. úr gjallarhorni og einföldum tækjum. Lýsing og flagg þegar opið er.   "
"14","101 Hverfakort "
"9","Lagfæring á sleðabrekku í Seláshverfi Það er skemmtileg lítil brekka í Seláshverfi þar sem börn koma saman og renna sér á sleðum þegar veður leyfir. Brekkan afmarkast af Reykás 45  Skógarás 11 og Viðarás 19.   Börn hafa án efa rennt sér þarna alla vetur síðan hverfið byggðist. Þó er brekkan þannig gerð að það er mikið af stóru grjóti í henni og svo er hætt við að þau renni á ljósastaura við gangstíg neðst í brekkunni.  Tillagan er sú að brekkan verði lagfærð, þannig að börnum stafi ekki hætta af því að renna sér þarna."
"15","Ryðja snjó af stígunum á Klambratúni Það væri næs ef snjórinn væri ruddur af stígunum á Klambratúni. Það var gert vel fyrir nokkrum árum en virðist hafa dottið uppfyrir."
"3","Byggingabann á Öskjuhlíð"
"3","Blómlegt Bergstaðastræti Gatan verði þrengd með breiðari gangstéttum  eyrum og hjólabraut. Hægt væri að setja eyru með blómakerjum út á götuna til að brjóta upp þessa beinu línu sem Bergstaðastrætið er, það býður upp á hraðakstur, Gangbraut verði sett, þannig að örugg leið sé fyrir skólabörn yfir götuna."
"15","Breikkun göngu/hjólastígs við sæbraut Breikka stíginn og hafa bæði hjólreiðastíg og göngustíg með umferð í báðar áttir. Þetta fyrirkomulag er í Laugardalnum fyrir ofan Laugardalshöll og hefur virkað vel."
"21","Lagfæra göngustíga í fossvogi Það má gjarnan lagfæra úr sér gengna og sumstaðar hættulega göngustíga í fossvogi  t.a.m. efri hluta göngustígs frá Keldulandi að Kúrlandi við grasbrekku og niður með Óslandi, sérstaklega neðst og breikka þann göngustíg samhliða."
"8","Fjarlægja aðgangsslár að búningsklefum í Vesturbæjarlaug"
"3","Stækka græna svæðið innan veggja Vesturbæjarlaugar Í kringum Vesturbæjarlaug er svæði sem lítið er nýtt. Með því að taka það svæði inn fyrir veggi/girðingu Vesturbæjarlaugar  myndi skapast stórt leiksvæði fyrir sundgesti, bæði unga sem aldna. Hægt væri að koma upp tækjum fyrir líkamsþjálfun, mínígolfi og fleiri tegundum af pottum og vaðlaugum."
"11","Laugavegur sem göngugata allt árið Nú er búið að gera Hverfisgötuna að flottri og vel skipulagðri umferðargötu. Þar getur fólk keyrt og hjólað um eins og þeim sýnist  sem er frábært. Spurning mín er: Er nauðsynlegt að Laugavegurinn sé líka umferðargata? Hvernig væri það nú ef að Laugavegurinn gæti verið göngugata allt árið um kring. Hægt væri að setja upp götumarkaði og fengið smá stemningu í götuna í staðinn fyrir að fá reykinn í lungun og augun þegar maður gengur götuna. "
"13","Að byggja barnvæna útisundlaug við Sundhöllina Það mætti fara að fríska upp gömlu höllina og þá væri kjörið að setja upp barnvæna útilaug jafnvel með útiklefum. "
"11","Auka ruslatínslu úti við"
"14","Suðurgata-gangstétt Laga gangstéttina sem liggur meðfram Suðurgötu við Háskólann."
"3","Innkeyrsla að Fálkaborg Innkeyrslan við leikskólann Fálkaborg er stór hættuleg. Keyrt er inn frá Fálkabakka niður bratta brekku inn á bílastæðið. Búið er að teikna nýja innkeyrslu og er það von mín að þessu verði breytt"
"11","Grasblettur á horni Nýlendugötu og Seljavegar gæti verið fallegur garður Þetta er lítill grasblettur sem gerir lítið annað en að safna rusli þessa dagana en þarna mætti gera lítinn fallegan garð með bekk og gróðri.  "
"15","Bíll - Strætó - Hjól"
