"18","Almennilega líkamsræktarstöð í efra breiðholtið Það væri mjög gott ef hægt væri að koma upp almennilega góðri líkamsræktarstöð í efra breiðholtið(Fella- og hólahverfið) svo að íbúar þar þurfi ekki að fara alla leið niður í Ögurhvarf til að fara í ræktina."
"15","Miklabrautin í stokk eða neðanjarðar Setja Miklubrautina í stokk eða neðanjarðar. Meirihluti þjóðarinnar býr á þessu frímerki (höfuðborgarsvæðið) og stórhluti þessi fer um Miklubrautina á hverjum degi í skóla eða vinnu. Það er kominn tími til þess að gera samgöngur þessa fólks auðveldari."
"4","PRufa  verður eytt"
"14","Fleiri ruslafötur í miðbæinn"
"8","Sjópott í Grafarvogslaug Sjópottur eða saltvatnspottur kæmi sér vel í Grafarvogslaug. Potturinn gæti verið sambærilegur við þann sem er í Laugardalslauginni."
"15","Gangstéttir í Bökkunum Það er löngu kominn tími á lagfæringu á gangstéttum í bakkahverfinu."
"14","Betri lýsingu við göngustíga meðfram Miklubraut við göngubrú milli Kringlu og Fram. Göngubrú yfir Kringlumýrarbraut á kaflanum milli Miklubrautar og Háaleitisbrautar til að tengja saman Hlíðarhverfið norðan Miklubraut og Áltamýrahverfið."
"15","Stofnleið strætó út alla Hringbrautina Mikilvægt er að bæta samgöngukerfi Reykjavíkur  eða Strætó BS stofnleiðir. Bæði þarf að fjölga þeim og skipuleggja betur. Þá að ný strætóleið verði bætt við, amk á háannartímum sem fer amk frá JL-húsinu/Granda framhjá HÍ, Landspítalanum í Hringbraut. "
"15","Loka Háteigsvegi við Rauðarárstíg "
"25","Skjól á Grandavegi Það væri til mikilla bóta ef borgin gæti gróðursett nokkur tré  helst greni neðst við Grandaveg næst sjónum til að brjóta niður vindhviður sem verða til umhverfis háhýsið að Grandavegi 47. Í NV- átt er varla stætt í nágreni við húsið og ekki batnar það þegar búið verður að byggja háhýsið á Lýsislóðinni en þá verður Grandavegurinn orðinn að vindgöngum ef ekkert verður að gert."
"15","Ekki þrengja Grensásveginn Komið hefur upp hugmynd um að þrengja Grensásveginn og setja hjólastíg. Það er mikið óráð  vegurinn er tiltölulega greiðfær eins og hann er og um hann fara daglega margir sjúkrabílar til dæmis. "
"15","Umferðarljós yfir Ánanaust Umferð þeirra sem kjósa að ganga og hjóla í Bónus og Krónuna út á Granda eykst sífellt. Það er hins vegar mjög erfitt að komast yfir Ánanaustið þar sem það vantar almennilega gangbraut þarna yfir og helst umferðarljós. "
"14","Endurbætur á Aparóló (milli Einarsness og Skildinganess)"
"14","Hröð og mikil bílaumferð á Flókagötu - mótvægisaðgerðir"
"11","Kelduskóli - Korpa  skjólsæli skólalóð Lagt er til að gróðursett verði í kringum skólalóð Kelduskóla - Korpu til að mynda skjól á leiksvæði barnanna.  Svæðið er mjög vindasamt og því mikill þörf á því að bæta aðstæður barnanna sem þarna ganga í skóla. "
"17","Lifandi og virkar hverfastöðvar. Ætli þetta sé ekki hugmynd sem á við öll hverfi en ég bý í Árbæ og labba mikið um það útisvæði  ég er alltaf að býða eftir því að það poppi upp einhverskonar viðkomustaður þar til að einda eftir góðan rúnt með fjölskyldunni. af hverju er ekki hverfastöð við göngusvæðið t.d. fyrir neðan sundlaugina, frábær staður, miðsvæðis og það safnar hvort eð er of vöxnum arfa þar öll ár og bíður þess að vera nýtt, það þarf ekki að vera kaffi hús nema áhugasamir rekstraraðilar vilji koma því þannig fyrir.. >"
"3","Áningarstaði við hjóla- og göngustíga Skýli sem veitir skjól fyrir veðri og vindum "
"11","Hunda leik garður í Vesturbæinn! Þessi hugmynd er fólgin í því að gras flöturinn fyrir aftan Vesturbæjarlaugina gæti haldist sem bara hundagarður og eitthvað fyrir almenning. En þetta væri fyrst og fremst einungis fyrir hunda og eigendurna til að leika sér  helst lausum . En þá vanntar ruslatunnur, bekki, ljósastaura og grindverk."
"18","Endurnýja stíg frá Grænastekk að Stekkjaróló Þessi stígur í gegnum hverfið er orðinn ansi lúinn  brotnar hellur og fleira.  hann er mikið notaður af íbúum"
"14","Að laga göngustíginn á milli Sólvallagötu og Ásvallagötu.  Laga göngustíginn með því að hreinsa steina  jafna stíginn og malbika hann. Bæta lýsingu. Ganga frá grindverki við bílastæði Ásvallagötumegin. "
"9","Opinn leikskóli þar sem foreldrar eru með börnunum Leikskóli þar sem foreldrar (eða aðrir umönnunaraðilar) geta mætt með börnin sín og hitt aðra foreldra og börn. Þarna gætu foreldrar rætt saman  leikið með börnunum og börnin leikið bæði úti og inni.    Væri svo jafnvel hægt að hafa hóflegt gjald fyrir að nýta aðstöðuna sem myndi nýtast í viðhald.   Þyrfti að hafa umsjónarmanneskju með húsinu."
"15","Aðgreina strætóskýlin sem eru sitthvorumegin við götuna."
"24","Bæta gangstíg við Snorrabraut. Aðkallandi er orðið að ráðist sé í endurbætur á aðstöðu gangandi og hjólandi á Snorrabraut allri. Brýnasti hlutinn er vestanmegin  sirka frá Blóðbankanum og suður að gatnamótum við Hringbraut. Laga þrengingu við Blóðbankann vegna  gróðurs sem slagar út á gangstétt og staura sem ná hálfan meter inn á síginn svo erfitt er að mætast með vagna, á hjólum og í raun gangandi. Taka upp gamla og úr sér gengna hellulögn og leggja uppá nýtt eða leysa á annan máta. Gera leiðina greiðari yfir gatnamót."
"15","Hraðahindrun/anir á Reynisvatnsveg"
"3","Minni umferð eða hægja á henni á Selásbraut."
"14","Göngustígar og tvær brýr yfir Bugðu  Norðlingaholti"
"5","My idea on how to expose financial tyranny and end it forever A few years ago I read some articles written by an American lecturer by the name of David Wilcock. He started a website called Divinecosmos.com which is about spiritual upliftment and exposure of criminal private interest groups working under the mysterious freemasonic Illuminati. The articles are about how the financial system has been overtaken worldwide (except in Iceland). The articles hold extensive information and are recommended reading by all Icelandic peoples.    "
"15","Setja upp vefsíðu með upplýsingum um færð hjólreiðastíga"
"6","Make rainbow flag colored crosswalks at important intersections in downtown Rvk. Follow the example of Vancouver and create rainbow colored crosswalks at several intersections in the downtown area. This falls into several categories: t.d. framkvæmdir  menning og listir, and above all, mannréttindi"
"14","Gera undirgöng frá Hallsvegi að Gufunesi Það er alveg komin tími á að gera undirgöng undir strandveg frá Hallsvegi að útivistarsvæðinu í Gufunesbæ. Það er endalaust mikið af krökkum að fara yfir þennan veg. "
"9","Gervigrasvöll í horninu á Landakotstúni  við mörk Túngötu og Hólavalla. Setja upp gervigrasvöll á Landakotstúni við mörk Túngötu og Hólavallagötu. Þarna er huggulegt svæði sem gæti orðið enn skemmtilegra ef krakkarnir gætu sparkað bolta þarna án þess að eyðileggja gróður."
"13","Minnka ljósmengun frá Þróttaravellinum - kastarabirta sker í augu þeirra sem búa í sjónlínu frá honum. Ljóskastarar frá Þróttaravellinum skerða lífsgæði íbúa á efri hæðum í blokkum við Kleppsveg og ábyggilega hjá fleirum. Birtan sker í augun."
"15","Breyting á Goðheima  til að hægja á umferð og bæta öryggi barna Fleiri foreldrar hafa áhyggjur af öryggi barna sinna. Hugmynd var sett fram hér á Betri hverfi - Laugardalur um aðgerð til þess að bæta úr þessu  en þótti ekki træ vegna útfærslu. Það ætti að leita að útfærslu sem er tæk. Til dæmis að bæta við þreningar.Eða biðstöðu-vistgata  ?"
"14","Klára gangstéttirnar í Esjugrund Klára að skipta út gangstéttum henda út ónýtum hellum og steypa gangstétt í Esjugrund, held að það séu tvær gangstéttir eftir, fyrir framan Esjugrund 23-27 og 42-52, "
"14","Gangbrautarljós á Fjallkonuveg við Jöklafold Mikið af börnum sem fara þarna yfir. "
"11","Gróðurhús fyrir borgarbúa "
"4","Hiti í gangstéttar á Hofsvallagötu Það er mikil umferð af gangandi við Hofsvallagötu og fljúgandi hált oft.  Ef það væri settur hiti í gangstéttarnar  öðrum meginn, þá væri hægt að komast gangandi á hreinum gangstéttum alla leið niður í miðbæ.  Hringbraut er með hita í gangstéttum og einnig framhjá kirkjugarðinum og niður Tjarnargötu og svo er miðbærinn allur hreinn."
"14","Göngu- og hjólabraut meðfram allri strandlengjunni Tengja saman göngu- og hjólastíga frá Gullinbrú að Hamrahverfi - meðfram ströndinni fyrir Gufunes og þaðan út í Geldinganes. Nú er stór eyða í göngu- og hjólastígakerfinu meðfram ströndinni vestast. Þetta er e.t.v. 2-3 kílómetra langur stígur."
"9","Æfingaslár í Hljómskálagarðinn"
"9","Uppl um Skautafærð á Tjörninni á vef Reykjavíkurborgar"
"10","Prufa  verður eytt  Prufa  verður eytt Prufa, verður eytt Prufa, verður eytt Prufa, verður eytt Prufa, verður eytt Prufa, verður eytt Prufa, verður eytt Prufa, verður eytt Prufa, verður eytt Prufa, verður eytt Prufa, verður eytt Prufa, verður eytt "
"7","Setja upp aðstöðu fyrir unga vegglistamenn"
"9","Hundalaug Aðstaða fyrir hunda í Reykjavík er ekki nægilega góð. Mjög fáir staðir eru í boði þar sem þeir eiga möguleika á að synda.  Legg til að gert verði nýtt útivistarsvæði fyrir hunda sem væri með sérstakri laug þar sem hundar geta synt og væri nothæf allt árið um kring. Skráningargjöld hunda væri hægt að nota til að fjármagna þetta :)"
"14","Vantar perur í götulýsingu í Fossvogsdal og Elliðárdal"
"15","Borgartún  Röng ákvörðun varðandi hjólastíga báðum megin í Borgartúni veldur mun meira óöryggi gangandi vegfarenda. Þegar fara á yfir götuna þarf að líta til beggja hliða þrisvar sinnum á örskotsstund til að lenda ekki fyrir  hjóli  bíl,hjóli" við þessa stuttu vegferð."
"11","Búa til útigerði fyrir hunda í Reykjavík"
"3","Kaffihús í Hlíðarnar Það vantar kaffihús í Hlíðarnar. Á Kjarvalsstöðum er reyndar kaffihús en það er bara alltaf lokað þegar fólk er í vinnu. Afskaplega væri ljúft að geta gengið að þessu eða öðru kaffihúsi í Hlíðunum opnu síðdegis eða á kvöldin a.m.k. einhverja daga í viku. "
"9","Strandblakvöllur Blak er mjög vinsæl íþrótt.  Það mætti t.d. staðsetja hann á auðum malbikuðum velli sem er við gömlu strætóleiðina við Hjallasel (leikskólana við Hálsasel)."
"20","Strandstígur í vestanverðum Grafarvogi. Tengir saman strandstíga í Grafarvogi. Strandstígar sem eru vel tengdir í báðar áttir eru með vinsælustu stígum í Reykjavík. Það liggja stígar við ströndina að norðan og sunnan í Grafarvogshverfi en notkunargildi þeirra má stórauka með því tengja þá saman með strandstíg að vestanverðu. Leggja má stíg undir Gufuneshöfða fyrir neðan Hamrahverfið. Þaðan að Gufunesi. Meðfram Sorpuvegi og beint norður að gamla Gufunesvegi. Þaðan að Strandvegsstígnum að norðan."
"18","Mínigof í stað körfuboltavallar við Blöndubakka/Dvergabakka. Átján brautia minigolf."
"3","Gróður og hljóðmön við Borgaveg Bæta við hljóðmön og gróðri við norðanverðan Borgarveg við Gufuneskirkjugarð. Á Borgavegi er nú 50 km hámarkshraði. Sambærileg framkvæmd hefur þegar verið gerð á Borgavegi við Gullengi  og vestan Víkurvegar við Egilshöll."
"14","Lagfæra göngustíga í Bakkahverfi Víða er göngustígar í hverfinu í mjög slæmu ástandi og löngu tímabært að laga þá.  Yfirborð þeirra er víða ójafnt  eftir vetrarfrost og vanrækslu."
"24","Bekkur Bið um bekk til að setjast á milli Laugavegar og að Sundhöll Reykjavíkur. Eldri borgarar ganga daglega frá Skúlagötu í Sundhöllina og vantar bekk til að setjast á. "
"15","Gangbrautarljós yfir Arnarbakka - Gagnast skólabörnum í hverfinu Ég legg til að sett verði gangbrautarljós yfir Arnarbakka  t.d. við gangbrautina sem staðsett er næst Dvergabakka. Ljósin myndu auka mikið á öryggi skólabarna sem eiga þarna leið um daglega. Umferð um þessa götu er allt of hröð og skyggni er víða ábótavant vegna gróðurs, hleðslu o.fl. "
"14","Sparkvöll í vesturbæinn. Það eru sparkvellir (gervigras) út um allt í Reykjavík en enginn í vesturbænum. Það er t.d. hægt að gera það á svæðinu hjá Melaskóla en þar eru þrír vellir en allir á malbiki."
"14","Fegrun Grensásvegs milli Miklubrautar og Suðurlandsbrautar Grensásvegur milli Miklubrautar og Suðurlandsbrautar er afar fjölfarinn vegspotti með mörgum ágætum fyrirtækjum  verslunum og m.a.s. hóteli. Það þarf hreinlega að hugsa þessa götu alveg upp á nýtt með tillitið til gróðurs, bílastæða, gatna, gangbrauta, hljóðmana, almenningsö-samgangna o.fl. atriða."
"14","Ruslatunnu við strætóskýli á Háaleitisbraut rétt ofan við gatnamót Ármúla Það er mjög langt í næstu ruslafötu á þessu svæði og strætóskýlið er mikið notað af t.d. nemendum úr FÁ. Með því að setja upp ruslatunnu á þetta svæði yrði minna um rusl á svæðinu og umgengi myndi batna. Það er stutt í 10-11 og ísbúðina í Miðbæ frá þessu skýli og fólk þarf að geta hent matarumbúðum á góðan hátt."
"14","Sprengja niður sementsturninn við sævarhöfða"
"24","Matjurtargarður fyrir ofan fótboltavöllinn í Hallargarðinum v. Fríkirkjuveg 11. Að borgin stingi upp og útbúi matjurtagarð sem nágrannar geta nýtt sér og ræktað matjurtir í. Það er hægt að sækja um að fá að nýta litla spildu þarna  eða húsin í kring deilt þessu með sér, en eins og er er svæðið algjörlega ónýtt, úr sér vaxið og gleður ekki augað. Í leiðinni mætti gjarnan laga mörkin, þá getur  fjölskyldan reitt arfa saman, sparkað bolta og notið þessa svæðis í ríkari mæli. "
"14","Landakotstún borð  bekkir og grill, etv. minigolf eða álíka"
"14","Bekkir við hitaveitustokkana. Þörf er á bekkjum við hitaveitustokkana þar sem göngugarpar geta hvílst á ferðalagi sínu. "
"9","Skautasvell við Vitatorg yfir vetrarmánuðina Yfir vetrarmánuðina væri hægt að koma upp ágætu skautasvelli á Vitatorgi við Hverfisgötu líkt og sett var upp á Ingjólfstorgi einn vetur tímabundið fyrir nokkrum árum. Víða erlendis eru skautasvell sett upp tímabundið á torgum án mikillar fyrirhafnar og til dæmis getur verið stemning að fara á skauta í miðbænum fyrir jólin."
"9","Vatnsbrunnur í Grafarholt og Úlfarsárdal Vatnsbrunni yrði komið fyrir við göngustíg eða útivistarsvæði í Grafarholti/Úlfarsárdal.  Augljósir staðir væru t.d. við Reynisvatn og/eða við nýjan göngustíg meðfram Úlfarsá."
"4","Vatnsrennibrautargarður. Hugmyndin er að nýta það ódýra vatn sem er í boði í Reykjavík og opna hér almennilegann vatnsrennibrauta garð eins og gengur á mörgum ferðamanna stöðum í heiminum. Hugmyndin er líka að vinna þetta í samstarfi við innlenda plaströraframleiðendur ef mögulegt er. Ég held að ef tekið er mið af þeirri fjölgun ferðamanna til landsins muni svona garður hæglega ganga upp svo ekki sé talað um þá Íslendinga sem myndu nýta sér staðinn sér til ánægju. "
"4","Herða betur umferðarreglur."
"14","Endurnýja girðingu við frístundaheimilið Sólbúa Sólbúar er frístundaheimili við Breiðagerðisskóla. Girðing á milli lóðar þeirra og nokurra garða við Mosgerði er ónýt og þarf að endurbyggja."
"15","Afnám hægri reglunnar í Grafarvogi Að hægri reglan verði ekki lengur notuð í umferðinni í Grafarvogi. Að sett verði upp biðskyldumerki á viðeigandi stöðum."
"12","Test test test es tewsr f"
"14","Grenndargarður í Laugardalshverfi"
"10","Endurskoðun á innritunarkerfi leikskóla"
"14","Endurbætt leiksvæði"
"11","Ókeypis grænar endurvinnslutunnur í öll hús í Reykjavík"
"15","Hjólaleið við Hörpu"
"14","Endurbæta gönguleið og garð milli Snorrabrautar og Leifsgötu   Endurbæta og opna á ný gönguleið sem liggur úr Norðurmýri  yfir Snorrabraut og um garð milli Snorrabrautar og Leifsgötu. Einnig endurbæta garðinn sjálfan."
"15","Snorrabrautin - undarlegar þrengingar Snorrabrautin hefur verið þrengd  væntanlega til öryggis fyrir gangandi vegfarendur. Þrengingarnar skapa mikla hættu fyrir akandi vegfarendur. Ef á annað borð á að leyfa akstur þarna, væri rétt að gera eins og tíðkast í löndum þar sem búið er að skoða umferðina vel, liðka fyrir í beygjum og leyfa umferðinni að fara sína leið. Það má bara minnka hraðann niður í 40 t.d. til að hægja á umferðinni. "
"14","fagráð verði haft með í framhvæmdum."
"14","Laga gangstétt við Háaleitisbraut 14-30 Það er mikil umferð fótgangandi og hjólandi vegfarenda á öllum aldri um þessa gangstétt og með viðgerðum yrði gangstéttin öruggari og fallegra umhverfi myndi hvetja til betri umgengni. Það yrði líka betra fyrir fólk á línuskautum og með vagna að vera á ferðinni á svæðinu."
"13","Stytta afgreiðslutíma ÁTVR á laugardögum  við Austurstræti "
"14","Malbika gatnamót í höfuðborginni. Nauðsynlegt er að laga gatnamót í höfuðborginni. Víðast hvar eru djúp för sem geta valdið stórslysum þegar það fer að kólna og ísinn lendir. Fyrir utan það að það mætti líkja keyrslu yfir stærstu gatnamótin við það að keyra á stóru þvottabretti  sem til lengri tíma fer illa með bílana."
"6","Götublað sem heilimislaust getur selt til að afla sér tekna"
"14","Göngubrú yfir Breiðholtsbraut"
"15","Biðskylda verði almenna reglan þar sem húsagötur koma að safngötum.  Í hverfum með flokkuðu gatnakerfi eins og flestum yngri hverfum er það ólógiskt að láta regluna hætta frá hægri gilda á gatnamótum þar sem húsagötur koma að safngötum. Eins og t.d. þar sem Dverga- Goða- og Hulduborgir tengjast Melavegi  en hann er safngata og strætisvagnaleið. Fullyrða má að sárafáir þeirra sem aka norður Melaveg fatti að þeir eiga að stoppa fyrir bíl sem kemur út úr þessum götum. Og vei þeim ef ökumaður þess bíls er sérvitringur sem ekki þekkir annað en að standa á rétti sínum."
"15","Laga gangstétt við Skipholt 1 - 7  verst er ástandið við nr 3 Gangstéttin  við Skipholt 1 - 7  er illa farin og verst er ástandið við nr 3.  Við bentum fyrst á þetta fyrir 15 árum og hefur því ekki verið sinnt þrátt fyrir að þetta flokkist undir eðlilegt viðhald.  Gangstéttin getur verið varasöm eldra fólki.  http://erna.is/frettir.htm "
"14","Gular saltkistur aftur í hverfin"
"14","Setja fleiri hámarkshraðaskildi í hverfið"
"13","Gistiskýli Skil að fjármagn sé erfitt á þessum tímum  þess vegna er ég tilbúin í þetta. Vil fá úthlutaðri lóð eða húsi og fá að breyta því í gistiskýli. Ég er tilbúin til að safna saman sterkum hóp sem er tilbúinn til að veita vinnu sína sem sjálfboðaliðastarf. Ég hef borið þetta undir marga og fengið góðar viðtökur. Svo það vantar lóð og styrk til efniskaupa, hann þarf ekki að vera hár. Ég mun einnig ganga í fyrirtæki til frekari styrks ef lóð/hús býðst."
"11","Flokkun á gleri Umbúðir úr gleri eru algengar fyrir ýmsar matvörur. Margir henda þessum krukkum í almennt sorp þar sem engin greiðsla fæst fyrir þær hjá Sorpu.   Víða erlendis má finna kúlulaga gáma fyrir gler á nokkrum stöðum í hverju hverfi  t.d þar sem rauði krossinn er með sína kassa. Mín hugmynd er að taka það upp hér í Reykjavík.  "
"14","setja beyjuljós fra breiðholtbraut niður að stöng"
"14","Malbika malarstíg milli Rafstöðvarvegs go kvíslahverfis"
"13","Stytta afgreiðslutíma ÁTVR á laugardögum  við Austurstræti "
"11","æfingarvélar á gönguleiðum fleiri æfingarvélar á gönguleiðum á Ægisíðu og i Skildinganessi. Eins þau er á þessi blasiðu (t.d.)   http://silownie-zewnetrzne.pl/index.php/pl/urzdzenia-silowni-zewnetrznej"
"21","Stundum er í lagi að lagfæra eftir vonda framkvæmd Þrenging Réttarholtsvegar skapar ekkert nema hættuástand. Í þrengingunni eru einnig hraðahindrun og gönguljós. Í fyrsta lagi skapar hún óþolinmæði þeirra sem keyra norður veginn þar sem umferðin suður á forgang. Þrengingin laðar að sér börn á hjólum sem vilja leika sér á þessum spennandi stað. Þrengingin skapar vandræði þegar bílstjóri beygir suður Réttarh.veg frá Langagerði og umferð til norðurs er í gangi  vegna nálægðar við gatnam. Þetta er mjög greinil. er farið er oft á dag um  óskapnaðinn."
"15","Göngutroðinn Stígur sem þarf möl og lýsingu  Tillaga er að hinn göngutroðni óupplýsti stígur  fái  möl og lýsingu.     Stígurinn er á græna svæðinu við Sundlaugaveg. Á milli Laugalæks og Otrateigs.  sjá kort / mynd "
"14","Hjólagrindur verði settar við Hörpu."
"11","Göngustígar Að kenna/upplýsa almenning hvernig á/má ganga (eða hjóla) eftir göngustígum í Reykjavík. Á eða ætti að ganga/hjóla hægra megin á stígnum. Sumir eru líka á rafskutlum!"
"3","Lækinn aftur í Lækjargötu og meðfram gamla hafnarbakkanum! Lækurinn í Lækjargötu verður opnaður aftur á vestari akreinum Lækjargötu  frá Tjörninni og að Geirsgötu. Hann mun tengjast þar læk frá tjörnunum litlu við Hörpu, meðfram gamla hafnarbakkanum, austan við Tollhúsið og vestur Geirsgötu að bláu verbúðunum við höfnina.   Geirsgötu verður hleypt í göng frá Kalkofnsvegi að hringtorginu við Granda.  Í stað banka og annarra risahúsa verður búin til ný götumynd í anda Laugavegs, lág, litrík hús með verslunum og íbúðum.  Sem sagt lifandi bæjarhluta!"
"14","Spjöld með hugmynd af æfingum á æfingarsvæðinu Klambratúni"
"14","Gangstéttir í Blesugróf. Hugmyndin er að laga gangstéttir sem eru orðnar sprungnar- sóðalegar og jafnvel hættulegar."
"9","Betrumbæta Hólavallatorg  Hólavallatorg norðan gamla kirkjugarðsins er sólríkt og skjólgott. Það dýrmæta rými nýtist hins vegar íbúum illa til útivistar því torgið er að stórum hluta undirlagt bílastæðum fyrir framan fallega húsaröð gamalla timburhúsa. Með því að breikka gangstétt og fækka bílastæðum mætti gera torgið mannvænna með borðum  bekkjum og blómakerjum. "
"15","Greiðari umferð upp á Bústaðaveg Til að greiða fyrir umferð mætti lengja beygjuakrein þar sem ekið er af Kringlumýrarbraut  til norðurs, upp á Bústaðarveg. Þar er oft mikil umferð bíla, sem beygja til vinstri, yfir Bústaðarbrúna. Með því að lengja beygjuakreinina til hægri, yrði umferð í þá átt mun greiðari."
"3","fgbhfgbfgb gbgfbbbbfereeeeeeeeeeeeeeeeeeeeeeeeeeeeeeee"
"16","Setbekki í Laugardal mætti  færa inn í sólarljós Setbekkir  t. d. á göngustíg niður af Holtavegi, hafa verið staðsettir í skugga, þar sem sólar nýtur ekki, þá mætti færa með litlum tilkostnaði. Fjarlægja ef til vill nokkra runna."
"11","Fleiri ruslatunnur og borgarstarfsmenn verða að tæma tunnurnar jafnt og þétt. Ruslatunnur í Vesturbænum fyllast hratt og virðast vera tæmdar sjaldan. Því er almennt rusl og pokar með hundaskít ansi víða!  Tunnurnar mættu vera skiptar í pappírstunnur og almennt sorp. Sumar þeirra mættu gjarnan vera í hæð barna."
"17","Lagfæringar á göngustíg að Heiðarborg Það þarf að laga ójöfnur og sprungur í göngustígnum sem liggur frá Selásbraut  framhjá Heiðarborg og gamla gæsló. "
"14","Skipulögð skíðabrekka fyrir börn í Laugardalinn "
"15","Lækun hraða og gangbrautaljós Selásbraut Taka þessa svo klluðu kodda í burt og koma með gömlu góðu hraðahindranir   trekk í trekk er keyrt á milli þeirra , fólk sem ferðast með strætó og fer út vestan meginn og þarf að fara yfir þarf oft að bíða umferðar í lengri tíma þar sem að vagnin safnar umferð fyrir aftan sig.  Börnin í hverfinu hafi 1 eða 2 staði til að fara örugt yfir götu sem er með 50km hámarkshraða"
"11","Götumyndafélög bæru ábyrgð á götumynd  með snyrtingu, rusla-, og þrifnaði. Götumyndafélög er ný hugmynd hérlendis  þó þekkist að nokkrar húseignir eigi saman skyldum að gegna gagnvart sameiginlegum heimreiðum. Götumynd er afmarkað svæði sem inniheldur marga aðila sem geta tekið ábyrgð ef þeim er boðið uppá það. Með skýrum ramma sem byggir á heimreiðahefðinni væri hægt að virkja það afl sem býr í götumyndinni við að snyrta hana og halda henni við, tæma ruslafötur, þrífa, laga til í blómabeðum og hafa skoðanir á hvernig best er að útfæra götumyndina og halda henni við."
"3","Flugvöllinn burt úr Vatnsmýri"
"4","Borgin stofni Borgarbanka (Besti Bankinn)"
"4","Hundagerðin á Google Margir eru komnir með snjall síma með gps. Væri æðislegt að geta leitað á kortinu Hundagerdi (já þeir skilja ekki íslenska safi) það eru svo margir sem vita ekki hvar gerdin eru. Eða týnast auðveldlega  eins og ég. og ekkert meira um það :)"
"14","Íþróttahús fyrir handbolta Byggja handboltahús sem næst kjörnunum  t.d. við Egilshöll."
"9","Minigolf/púttvöllur við Þorrasel - dagdeild eldri borgara Það væri mjög flott að fá minigolf/púttvöll við Þorrasel. Það væri gaman fyrir gestina og aðrir í hverfinu gætu nýtt sér aðstöðuna þegar hún væri laus."
