"11","grenndargaða í öll  hverfi í reykjavik.   grenndagarða í öll hverfi í reykjavik   þar sem fjölskyldur geta ræktað eigin matjurtir.  Þessir garðar eru líka samkomstaður fyrir hverfin og nágrannar þekkjast - þetta eykur öryggi innan hverfa.  Nágrannar deila með sér þekkingu á ræktun og þetta skapar vænt og grænt viðhorf í Reykjavík.  "
"14","Svæðið á milli Hallsvegar og  Gylfaflatar"
"3","Make better use of the space besides the Timberland store!"
"22","Hraðahamlanir/þrenging á hjólastíg við Barnaskólann í Öskjuhlíð Vegna nálægðar við barnaskóla og leikskóla í Öskjuhlíð þyrfti nauðsynlega að setja upp einhverskonar hraðahamlandi úrræði sitt hvoru megin við þann örstutta kafla hjólastígsins sem liggur meðfram skólahúsunum og skapar töluverða slysahættu. Sérstaklega með fjölgun rafmagnsvespa um stíginn.   Þetta gætu til að mynda verið álrið  sem krefðust þess að beygt væri í  S" til að komast á milli þeirra, eða þrenging stígsins með stóru grjóti.  Skilti sem minnir á börn að leik, væri einnig óvitlaust."
"15","Gera stofnbrautir fyrir reiðhjól  td. Rvk- Hafnafjörður"
"14","Lýsing á leikvöll við Bauganes"
"14","Slökkvum öll (götu)ljós 31. október í tilefni hrekkjavöku"
"11","Endurvekja hugmyndina um að fóstra leikvelli og græn svæði."
"9","Klifurvirki á Landakotstúni Í sumar sem leið voru gerðar endurbætur á litla leikvellinum á Landakotstúni við hornið á Hávalla og Hólavallagötu. Áhersla var lögð á fáein leiktæki fyrir yngstu börnin. Þarna mætti gera eitthvað fyrir eldri börnin líka og væri mög auðvelt  og sennilega ódýrt, að koma þarna upp vandaðri klifurgrind með rauðum köplum eins og er niðri í Hljómskálagarði."
"3","Fá fleiri skilti sem birta hámarkshraða í hverfið"
"3","Björgum Ingólfstorgi"
"25","Gerfigrasvöll á Lynghagaróló Lynghagaróló er staðsettur á milli Tómasarhaga og Lynghaga. Svæðið er talsvert sótt enda mikill unaðsreitur. Á vellinum er grófur malarvöllur  sem er lítið nýttur vegna hinnnar grófu malar og hve illa völlurinn er hirtur. Það væri kærkomið fyrir ungt fótboltafólk á nágrenninu að fá góðan gerfigrasvöll í líkingu við þann sem komið hefur verið fyrir á Melaskólalóð. "
"10","Efla endur- og símenntun kennara"
"11","Koma upplýsingum um flokkun til innflytjenda sem ekki kunna íslensku Nú á að flokka allstaðar og það er vel. Hitt er verra að margir innflytjendur skilja ekki íslensku og sumir þekkja ekki hugtakið flokkun sorps. Borgin þarf að finna leið til að kynna þetta betur fyrir þeim sem ekki tala íslensku. Til dæmis með myndum. "
"11","Grisja kjarrið við Breiðholtsbraut með göngustígum Grisja ætti kjarrið beggja vegna við Breiðholtsbraut og gera í leiðinni stígakerfi um það. Það gæti verið bara 50 cm breiður stígur sesm gerður væri úr saginu úr grisjuninni"
"20","Malbika g Nú flytur bókasafnið úr kirkjunni í Spöng. Það er laust húsnæði í Hverfoldarverslunarmiðstöðinni þar sem bankinn var áður. Þar væri æskilegt að fá barnabókastofu fyrir börn með foreldrum sínum og leikskólafólki."
"9","Lýsing á göngustíg niður við sjó í norðanverðum Grafarvogi Lýsa þarf upp göngustíginn sem liggur frá styttugarðinum og meðfram sjónum norðan megin í Grafarvogi meðfram golfvellinum.  Hann er mikið notaður en væri enn meira notaður ef hægt væri að sjá handa sinna skil þar á kvöldin.  Ef maður hættir sér í göngutúr þarna á kvöldin er engin leið að sjá misfellur sem hægt er að detta um eða illa innrætt fólk sem gæti setið um mann þar! "
"14","Hljómön við Miklubraut fyrir neðan Sogav  Rauða og Stóragerð"
"7","Bókasafn í Grafarholt Bókasafn er ekkert í hverfinu. Þetta er hverfistengd þjónusta sem hæglega mætti koma fyrir í hverfinu  t.d. í verslunarkjarnanum á háholtinu eða í öðru ónýttu húsnæði ætluðu undir verslun og þjónustu í hverfinu."
"14","Útikennslustofu í Grundargerðisgarð!"
"15","Gangbrautir á Leifsgötu"
"7","Prufa  verður eytt"
"25","Reitur Hagamelur - Kaplaskjólsvegur Á horni Hagamels og Kaplaskjólsvegar er grasflöt sem mætti fegra með því að gróðursetja tré  gera beð og setja bekk o.s.frv.."
"5","Nýta Akurey  Engey, Lundey og Þemey undir vindorkuver"
"23","Meira skjól meiri fegurð,meiri ylmur í lofti Að gróðursett verði ýmiss tré og runnar á auða svæðinu   sem liggur frá Hofsgrund/Vallargrundar gatnamótum  og niður eftir hallanum, niður að hringtorginu í hverfinu, síðan áfram á auða  svæðinu frá þessu sama hringtorgi, meðfram Hofsgrundinni ,að Helgugrund. Falleg þyrping trjáa, með birkið í aðalhlutverki Hafa trén í nokkrum þyrpingum,þar sem þau skýla hvert öðru.Jarðmön / manir ásamt nokkrum stórum steinum gæfu varanlegt skjól.Rifs- og sólberja runnar væru góð viðbót, sbr. ofar í hverfinu. "
"15","Fleiri gangbrautir í Grafarvog  sértaklega við skóla Í Grafarvogi búa rúmlega 18 þúsund manns en hér eru 8 gangbrautir og er aðeins ein þeirra við skóla  Borgarholtsskóla. Hinsvegar er nóg af hraðahindrunum og þrengingum á þeim stöðum þar sem gangandi vegfarendum er ætlað að ganga yfir götu.    Gangandi vegfarendur njóta hinsvegar meiri réttinda við að fara yfir götu á gangbraut en annars staðar. "
"5","My first test idea Lorem Ipsum er rett og slett dummytekst fra og for trykkeindustrien. Lorem Ipsum har vært bransjens standard for dummytekst helt siden 1500-tallet  da en ukjent boktrykker stokket en mengde bokstaver for å lage et prøveeksemplar av en bok. Lorem Ipsum har tålt tidens tann usedvanlig godt, og har i tillegg til å bestå gjennom fem århundrer også tålt spranget over til elektronisk typografi uten vesentlige endringer. Lorem Ipsum ble gjort allment kjent i 1960-årene ved lanseringen av Letraset-ark"
"7","Jólaborg alla daga - fyrst allra borga í heiminum!"
"7","Jólaþorp í Laugardalnum"
"24","Endurbætur á leikvellinum á Ósi  Bergþórugötu 20 Leikvöllurinn á Ósi er orðinn ansi lúinn og þarfnast gagngerra endurbóta. Það er algjört forgangsmál að koma þessum nærri 20 ára leikvelli í betra stand. Til tæmis þarf að bæta við leiktækjum og laga gróður og undirlag lóðarinnar. Hægt væri að setja upp klifurgrind eða kastala  þrautabraut eða rennibraut, gera bara eitthvað skemmtilegt og þroskandi fyrir börnin sem myndu svo sannarlega njóta þess að búa að almennilegum leikvelli."
"14","Vesturbæjarlaug Vegna ills aðbúnaðar á starfsfólki í Vesturbæjarlaug. Vantar innilaug sem eykur öryggi þeirra sem eru að læra sund og einnig bætti ætla að það auki öryggi þeirra sem þar finna. Einnig vantar meiri og betri gæslu á útisvæðum og í turni."
"15","Laga hraðahindranir á Selásbraut "
"15","Göngu -og hjólastíg yfir Snorragötu frá Brietartúni að Skúlagötu Það er hættulegt að þvera Snorrabraut frá Brietartúni og yfir á Skúlagötu. Hún er tvöföld í báðar áttir. Við enda Snorrabrautar hjá húsnæði Ríkislögreglustjóra sést á grasinu þar að margir eiga leið þar um. Þetta ætti að vera upphækkuð zebrabraut vel merkt sem lægi yfir allar 4 akreina Snorrabrautar."
"10","Kennum gagnrýna hugsun í grunnskólum"
"3","Botnlangahringtorg á milli Þangbakka 8 -10 og Breiðholtskirkju Setja hringtorg á milli þangbakka 8-10 og Breiðholtskirkju og auka þannig og fegra aðgengi að kirkjunni og fyrir íbúa Þangbakka 8-10 sem eru að stórum hluta eldri borgarar. Má benda á svona torg fyrir framan Háskólann í Reykjavík. Það er það vítt að hægt er að stoppa til að hleypa út farþega eða sækja án þess að vera fyrir öðrum í hringtorginu. Við Þangb.er í dag gangstígar sem verið er að keyra um til að komast nær inngangi að Þangb. og kirkjunnar og því eru gangstéttarhellur farnar að aflagast"
"4","Láta gamlar hugmyndir aftur inn í kerfið  "
"14","Framkvæmdir í Fellagörðum."
"10","Móta heildstæðari kennsluaðferðir í skólum"
"14","Græni trefillinn - skógrækt og skjólbeltarækt Verkefnið snýst um ræktun skógar og skjólbelta norðan þjóðvegar í Esjuhlíðum og gæti verið stórt og metnaðarfullt verkefni fyrir Reykvíkinga."
"3","Gera Grensásveg að vistvænlegri götu  Mjög mikil bílaumferð er við Grensásveg og ekkert pláss fyrir gangandi og hjólandi eins og einkennir Skeifuna og þetta svæði.    Það ætti að taka þessa götu í gegn  Með breiðum göngugötum, hjólastígum, markvissri gróðursetningu (skjólmyndun) og bekkjum. Skapa mannlegt, vistvænt umhverfi. Þarna er mikið af veitingastöðum og starfsemi í kring sem gætu einnig hagnast af slíkum aðgerðum."
"11","Ruslatunnur - reykingar"
"14","Stæði við Leirtjörn. Það þarf að laga stæðið  ekki endilega að malbika heldur frekar að lýsa það upp og laga stíflað ræsi."
"10","Að leggja niður starfsmannaafslátt inni á leikskólum"
"4","í kosningum um betri hverfi verði gert auðvelt að sjá meiri upplýsingar um verk lýsingar á verkefnum til að kjósa um voru knappar   eru, og erfitt að átta sig á um hvað þær snúast, hvar þær eru , og hvort þörf er á breytingunni, þar væri gott að geta klikkað á hugmynd og fá að sjá kort af svæðinu með götunöfnum, kannski teikningu eða mynd af fyrir og eftir  eða hugmynd um það á mynd, kannski álit einhverra málsmetandi manna td skipulagsfræðinga borgar , finnst þeim þetta þarft eða annað þarfara, kostir og gallar , td vísað á umræðuna á vefnum , hægt að klikka á hlekk að því"
"4","Slöngur á Geirsnef Hundaeigendur eyða töluvert mikið tíma á Gersnef svæðinu. Að setja upp vatns slöngur væri meira en velkomin bæði fyiri hundaeigendur sem fyrir borgarbúa. "
"11","Loka galopnum ruslatunnum við Selásbraut."
"20","Setja upp leiktæki á leiksvæðum í Hamrahverfi í stað þeirra sem rifin voru niður Árið 2011 voru flest öll leiktæki á opnum leiksvæðum í Hamrahverfi rifin niður. Engin leiktæki hafa verið sett upp í staðinn fyrir þau fyrir utan einn kastala. Leiksvæðin eru því lítið sótt sökum skorts á leiktækjum og vanhirðu. Koma þarf svæðunum í fyrra horf með uppsetningu nýrra tækja  enda ólíðandi að þjónusta við yngstu íbúa Hamrahverfis og tækifæri þeirra til útiveru sé skert með þessum hætti án nokkurs samráðs við íbúa á sama tíma og offita og hreyfingarleysi barna fer vaxandi."
"14","Snjóruðningur"
"15","Hraðahindrun á Ljósvallagötu"
"1","Aukin  bílastæði við fjölbýlishús við efsta hluta  Hraunbæjar  og gróður á svæðið Samþykkt verði að gera bílastæði á reitnum sem afmarkast af  efsta hluta Hraunbæjar  Tunguháls og Bæjarháls.  Á þessu svæði mætti gera bílastæði þvert á  milli Bæjarháls og Hraunbæjar með fallegum gróðri á milli sem jafnframt skýlir okkur frá bílasölunum hinum megin við svefnherb.glugggana okkar.  "
"11","Borgin beiti sauðfé á skógarkerfilsbreiður Til að stemma stigu við útbreiðslu kerfils fái borgin sauðfé að láni hjá sauðfjáreigendum í borginni til að beita á kerfilinn. Til að mynda þeim sem halda fé sitt í fjár- og hesthúsahverfinu Fjárborg.   Þekkt er að sauðfé heldur kerfli í skefjum  mun betur en sláttur.  Sauðfjárbeit á grænum svæðum innan borgarmarka er þekkt til að mynda í Svíþjóð, og gefur það borgum hlýlegan blæ."
"9","Tónlist (eða útvarp) spiluð í sundlaugum um helgar"
"14","Reiðvegur undir Esjuhlíðum"
"20","Beygja fyrir hjól frá Langarima að Hallsvegi Þegar maður hjólar suður Langarima í átt að Hallsvegi þarf maður að stoppa til að taka 90 gráðu beygju  upp brekku í átt að Hallsvegi.  Það væri voðalega vel þegið ef hægt væri að geri þessa beygju meira aflíðandi, þannig að hægt væri að byrja brekkuna á meiri hraða og þannig spara hjólafólki erfiðið við að byrja að hjóla brekkuna á 0km/klst"
"15","Útskot við strætóskýli Við Bjallavað eru tvær strætisvagnastoppistöðvar. þar er nóg pláss fyrir innskot svo strætisvagninn stöðvi ekki umferð á meðan hann tekur/skilar farþegum. Á fyrri stoppistöðinni er tímajöfnun strætisvagna og er stórhættulegt að taka fram úr honum þar því yfirsýn er engin fram fyrir vagninn. Ef taka á fram úr er það gert í þeirri von að enginn komi bíllinn á móti á meðan. Seinni stöðin er mun betri hvað varðar að taka fram úr því yfirsýnin er þó nokkur. Besta lausnin er að setja innskot ."
"15","Fjarlægja hindrun fyrir gangandi / hjólandi Það verður að fjarlægja steypukant og stálboga sem loka göngugötuna sem tengir hjallasel/flúðasel. Kanturinn er staðsettur við leikskólann Hálsaskóg.  "
"10","Skólinn taki sér listamann í fóstur"
"14","Fjölgun undirganga í hverfinu Það þarf að setja undirgöng til að bæta öryggi á göngu- og hjólaleiðum  sérstaklega fyrir suðurhluta Grafarvogs á leið í Egilshöll. Einnig til móts við Gufunesbæ."
"14","Fleiri bekki á sólríka staði  inn í íbúahverfið okkar"
"15","Hjólastígur meðfram allri Háaleitisbrautinni Færum okkur í nútímann og setjum hjólastíga meðfram allri Háaleitisbrautinni. Við vitum að hljólreiðar er vinstvænn og ört vaxandi samgöngumáti og mikill vilji er innan hverfisins Háaleiti og Bústaðir að draga úr akandi umferð götunnar. Hjólastígur meðfram allri Háaleitisbrautinn er mikil samgöngubót fyrir hverfið og alla borgina."
"15","Reiðhjólalyfta í Grafarholtið Reiðhjólalyftan er eins konar toglyfta  sem gengur fyrir rafmagni. Fæti er komið fyrir á pedala, sem dregur viðkomandi upp. Hún fer í gang, sé þar til gert kort notað til að starta lyftunni. Slík lyfta er til í Þrándheimi í Noregi og er nú 2. útgáfa hennar í notkun þar."
"4","Betri snjómokstur á gangstéttum í Grafarvogi Gangstéttir eru misvel mokaðar í Grafarvogi. Til dæmis eru bara sumar stéttir í kringum Kelduskóla - Vík mokaðar en aðrar ekki. Sama má segja um gangstéttir í nágrenni við Spöng og Borgarholtsskóla."
"15","Öruggt aðgengi barna að Laugardal. Börn sem sækja íþróttastarf í Laugardal þurfa að geta komist þangað án þess að fara yfir stórhættulegar stofnæðar. Brýr eða göng undir Kringlumýrarbraut og Suðurlandsbraut leysa þann vanda. "
"11","Eplatré í Grundargerðisgarð hæ  það hefur orðið mikil vakning varðandi ávaxtatré. Ég legg til að að  eplatré og önnur ávaxtatré verði gróðursett í Grundargerðisgarðinn, það bætir og kætir.  Garðyrkjufélag Íslands er tilbúið til að aðstoða við val á tegundum og veita alla ráðgjöf."
"22","Snyrta grindverk og tré kringum Hlíðarskóla.   Lagfæra trégrindverk eða jafnvel meta hvort það sé þörf að hafa grindverk og grisja grenitrjám. "
"9","Búningsaðstaða utan dyra í Breiðholtslaug"
"11","Slökkva á ljósum í verslunum og fleira um nætur"
"14","stífluð niðurföll og ranglega staðsett slík. Það þarf að sinna betur niðurföllum á götum Reykjavíkur. Þau eru allt of oft STÍFLUÐ  og þá lekur vatn í rigningum og leysingum ekki niður í ræsi heldur myndar tjarnir á götunum. Það er ekki gaman að ferðast um á hjóli, bíl eða gangandi þegar vatnsgusurnar ganga yfir mann af því að enginn sinnir þessu.   Sum niðurföll eru þannig staðsett að þau eru ofar heldur en þar sem pollar myndast. "
"15","Uppl. um ferðir Strætó gerðar aðgengilegri"
"15","Gangstígur úr Bryggjuhverfi um brekkuna upp á Höfða Samgöngumál í Bryggjuhverfinu eru ókláruð. Göngustíg vantar sem tengir gangstéttir hverfisins og stíginn umhverfis það við gangstéttir og Strætisvagnastoppistöðvar á Stórhöfða. Óformlegur stígur hefur myndast um brekkuna ofan við hringtorgið. Nauðsynleft er að leggja almennilegur stíg þar fyrir íbúana og aðra sem leið eiga um til að auka öryggi og hreinleika fyrir gangandi vegfarendur. "
"22","Grenndargámafjölskyldan Bæta við gámum fyrir gler og málm í hverfa-grenndargámafjölskyldurnar"
"14","Órækt við Kristnibraut 22"
"14","Ávaxtalundur og fleira í Björnslundi  Norðlingaholti"
"9","Takmörkun á umferð hunda í móa og fjöru við Ægisíðuna Að banna umferð hunda t.d. frá eystri enda Faxskjóls til vestari enda Sörlaskjóls eða öfugt. Bann á Ægisíðu en leyft við hinn endan. Líklega væri Bann vestan megin auðveldara i framkvæmd."
"17","Lýsing á göngustíg frá Nethyl að Elliðaárstíflu Göngustígur austan megin við gatnamót Nethyls og liggur alla leið mitt á milli Ystabæjar og Höfðabakka og þaðan niður að Elliðarárstíflu. Þessi leið er algjörlega óupplýst.  "
"14","Fleiri ruslatunnur og ljósastaura í kringum Elliðará "
"15","Leið 18 fari um Flugvallarveg."
"9","Hverfislaugarnar verði opnar á kvöldin"
"15","Lýsing göngu- og hjólastígs meðfram Strandvegi og Stararima Engin ljós eru á kafla við stíginn austan megin meðafram Strandveginum. "
"14","Klára malbikun í Háagerði Nokkrir af botnlöngunum í Háagerði eru ómalbikaðir. Miðað við þá umferð gangandi vegfaranda frá Réttarholtsvegi/Langagerði áfram inn í Háagerði þá er full ástæða að malbika og bæta lýsingu á þessum stöðum. Að auki auðveldar þetta aðkomu ruslabíla og minnkar slysahættu."
"4","Öryggisbelti í strætisvagna innanbæjar"
"10","MS við Suðurlandsbraut á móts við Glæsibæ Til stendur að stækka MS en hann er mjög aðþrengdur þar sem hann er. Ef skólinn er fluttur á þetta svæði við Suðurlandsbraut á móits við Glæsibæ geta nemendur notað dalinn í frímínútum til útivistar. Pláss fyrir fjölbýlishús verður þar sem MS er núna."
"15","Kerrugarður -  svæði sem borgarbúar geta geymt bílakerrur"
"15","test test test test tes tes tes tes t"
"14","Skemmtilegri Bollagöturóló fyrir börnin í hverfinu Okkur langar að stinga uppá að bæta við einhverju skemmtilegu á   Bollagöturóló sem er rólóinn okkar.  Kær kveðja  Arngrímur 6 ára, Magnús 3 ára, Kolfinna 1 árs, Sveinn 8 ára, Jóhanna 6 ára, Úlfur 5 ára, Þorvaldur 2 ára, Jón 7 ára, Einar 11 ára, Katla 6 ára, Ingvar 11 ára, Karólína og Ísold. "
"18","Timburhús með þaki fyrir fugla. Lítið timburhús með þaki fyrir fugla  í nágrenni leiksvæði. "
"14","Gangstétt við Hálsabraut"
"11","Gámar fyrir einnota gler."
"14","skilti sem banna notkun bifhjóla í Bakkahverfi"
"7","Frítt á söfnin! Að öll listasöfn borgarinnar hafi einn dag í viku þar sem ekki er tekinn aðgangseyrir.  Eða 3 klst á dag t.d. frá 10-13"
"11","Arnarhóll Betrumbættur!"
"10","Foreldrar geti verið dagforeldrar aukabarns eftir mæðraorlof"
"15","Fá aftur afnot fyrir strætófarþega á Lækjartorgi í húsinu "
"11","Umhirða á grænu svæði neðst í götu á milli Flétturima og Berjarima Hreinsa til og grisja vel trjágróður og gera svæðið fýsilegt fyrir íbúa. Laga sparkvöllinn þannig aðhægt sé að nota hann. Setja upp almennileg mörk og annað slíkt sem gerir völlin eftirsóttaverðann hjá börnunum."
"10","Örfa tengsl foreldri í skólastarfi"
"14","Hvíldarbekki við Bæjarháls í Árbænum! Það labba margir og hjóla Bæjarhálsinn en þar eru engir bekkir til að hvíla sig. Ég labba þar oft í sambandi við stærri hring og ég sakna þeirra það er að segja bekkjana."
"7","Lúðrasveit fyrir unlinga í menntaskóla"
"8","Byggja útisundlaug við Sundhöll Reykjavíkur"
"4","Athugið subbulegan reit  sem hefur orðið útundan í miðri Reykjavík við Sóltún 6 Veit að þetta er úthlutað svæði til Waldorfskóla sem er einkarekinn en eru ekki takmörk hvað menn hafa langan tíma til að gera snyrtilegt kringum sig og láta ekki njóla og illgresi þrífast í mölinni á stóru svæði. Þetta er ömurlegt og skammarlegt að íbúar á nærliggjandi svæðum þurfi að horfa á þetta  íbúar sem gera allt til að hafa snyrtilegt kringum sig og vera borginni til sóma. Þetta svæði virðist hafa gleymst hjá borgaryfirvöldum eða hvað?"
"9","Battavöll við Kelduskóla-Vík það er fótboltavöllur fyrir krakkana í Víkurhverfi.  "
"21","Fjarlægja grindverk neðan við nýja sleðabrekku neðan við Grímsbæ Fjarlægja grindverk neðst í nýrri sleðabrekku neðan við Grímsbæ áður en börn slasa sig á henni.  Einnig mætti gera brekkuna brattari og búa til flatan kafla neðst svo börn hafi tækifæri til að stoppa."
"10","Setja upp betra eftirlit/vöktun við skólalóðir"
"16","Endurnýja hjólavísa eftir Langholtsveg að vori Það hefur gerst nokkur undanfarin ár að hjólavísarnir  til dæmis eftir Langholtsveg hafa verið nánast horfnir að vori vegna slits, meðal annars sökum nagladekkja. Nú er farið að mála frekar en nota þykkan dýran massa. Merkin voru máluð upp í haust. Verður þetta eins vorið og sumarið 2015 og í fyrra ?  Merkin horfin og svo verður þetta látið standa fram að haust og þá málað ?  "
"15","Hraðahindranir - ca 2 - í Meðalholtinu"
"14","Framlenging vegriðs við gangstétt við Réttarholtsveg Framlengja þarf núverandi vegrið í framhaldi af brú yfir Miklubraut NV-megin við gatnamót Sogavegs og Réttarholtsvegs. Hér ættu 10-15m kafli að duga. Framkvæmdin gæti komið í veg fyrir alvarleg slys ef fólk færi óvart niður grasbrekku við hlið brúar niður á Miklubraut  t.d. á hjóli eða með barnavagn"
"14","Sparnaðarhugmyndir"
"14","Gangstígur frá KRI/MI  styðstu leið að Stigahlíð. Gangstígur frá vesturhorni KRI/MI að beygju á Stigahlíð verði lagður. Þ.e.   mikið farinn óskastígur gerður að færum heilsársstíg. Vestari endi lendi þannig að bein leið (ekki ganga til baka) sé bæði suður og suð-vestur Stigahlíð. "
"8","Körfuboltaspjald og plan við Dalskóla Uppsetning körfuboltaspjalds ásamt plani við Dalskóla nýtist nemendum í frímínútum og íbúum í frítíma sínum."
"3","Hljóðmön milli Skaftahlíðar og Miklubrautar til að minnka hljóðmengun! Það er löngu orðið tímabært að reisa hljóðmön á milli Miklubrautar og íbúðarlóða við Skaftahlíð. Mikil hávaðarmegngun er á þessu svæði og ekki hægt að heyra mannsins mál í görðum sem liggja að Miklubraut á álagstímum. Einnig er um að ræða öryggi þeirra barna sem leika sér á þessu svæði. "
"3","Skautaleiga við tjörnina Þegar Reykjavík er  vetraborg' og tjörnin er mælanlega frosin væri gaman að hægt væri að leigja skauta við tjörnina á þeim dögum sem það er viðeigandi. Þetta gæti líka falið í sér að yfirborð tjarnarinnar væri skafið til að bæta aðstæður fyrir skautara."
"14","Endurhita upp strætóskýli við Háskóla Íslands Það var sett upp sérstakt upphitunarkerfi í strætóskýli við Háskóla Íslands í þeim tilgangi að ilja farþegana inní skýlinu þegar það er kalt úti  en nú kemur enginn hiti frá því. Hvernig væri að endurræsa þetta hitakerfi svo farþegar þyrftu ekki að bíða úti í kuldanum? Ég er sjálfur nemandi við Háskóla Íslands og það eru fleiri nemendur en ég sem stunda nám við Háskóla Íslands sem nota strætó. Það myndi gera mikið gagn að koma hitanum aftur af stað."
"14","Girða kringum endurvinnslugáma"
"7","Pönksafn á Hlemm Ljósmyndir  textar, fatnaður og fleira frá pönktímabilinu yrði til sýnis á Hlemmi ásamt öðrum munum sem tengjast staðnum. "
"4","láta alla sem keyra fullir út að þrífa! "
"14","Endurbætur leiksskólalóð Fálkaborgar"
"15","Miklu miklu betra strætókerfi!!!"
"24","Hraðahindranir á Frakkastíg Hafa nokkrar hraðahindranir á leiðinni niður Frakkastíginn frá Hallgrímskirkjunni. Sérstaklega á efri hluta Frakkastígs þar sem fjölmörg skólabörn á leiðinni í Austurbæjarskóla og Grænuborg. Einnig er mikið um gangandi íbúa og erlendra ferðamanna vegna Hallgrímskirkju  kaffihúsa, sjoppu og ísbúð."
"11","Fegrun svæðis í Mjódd Gróðursetning trjáa og/eða blómstrandi runna við Stekkjabakka á mörkum bílaplans við Nettó."
"14","Tímabundinn frágangur á lóð við enda Vesturgötu og Ánanausts"
"14","Fjarlægja ljósastaura sem eru of nálægt gluggum í 101. "
"15","30km hámarkshraði og varúð til hægri innan Hringbrautar í stað aðalbrauta. Nota varúð til hægri í stað aðalbrauta og biðskyldu í íbúahverfum og lækka þannig mikið hraða bíla og neyða Ökumenn til þess að vera vakandi  sýna varúð og þar með skapa meira öryggi. Síðan sem bónus þá fækkar skiltum og 30km á klst er meira en nóg í gömlum þettbýlisgötum."
"3","Nýskipulag Þegar verið er að gera nýja hjólreiðastíga að passa að það séu ekki neinar beygjur  ekki hvassar brúnir og halli að götu sé ekki krappur. ekki einhverjar hindranir eins og hringtorg, stólpar og þess háttar."
"14","Samsíða göngu- og hjólastígar í sitthvoru lagi"
"9","Endurbætur á Aparóló (milli Einarsness og Skildinganess)"
"3","Grænmetishlemmur Mig myndi langa að sjá Hlemm breytast í grænt torg. Þetta myndi gera bæjinn okkar grænan og góðan  fyrir utan þess hvað þessi staðsetning er góð!"
"14","Battavöll í Vesturbæinn Verkefnið felst í því að setja upp battavöll í Vesturbæinn. Tala við KSÍ og þau sjá þá um að panta og setja upp. Völlinn mætti staðsetja á hentugum stað í Vesturbænum eða í nágrenni við KR. Hann gæti kostað um 10 milljónir."
"14","Lýsa upp gönguleið skólabarna við Langholtsskóla"
